{
  "type": "experiment",
  "id": "hrm:experiment/acomys-vs-mus-matched-wound-atlas",
  "name": "Matched single-cell and spatial atlas of Acomys versus Mus wound healing",
  "tests": [
    "hrm:question/what-limits-regeneration-in-mus-and-human"
  ],
  "status": "proposed",
  "design": {
    "species": "Acomys cahirinus (NCBITaxon:10068) and Mus musculus (NCBITaxon:10090)",
    "model": "identical full-thickness dorsal wounds",
    "intervention": "none (comparative)",
    "comparator": "species",
    "readout": "single-cell RNA and spatial transcriptomics of immune and fibroblast compartments at days 1, 3, 7, 14, 28; lineage tracing where tools exist",
    "duration": "6–9 months",
    "n": "3–5 animals per species per timepoint"
  },
  "discriminates": "Divergence appearing first in immune populations, in fibroblast lineage composition, or in matrix genes points at which hypothesis to perturb next.",
  "feasibility": {
    "costClass": "medium",
    "durationClass": "months",
    "requires": [
      "Acomys colony",
      "single-cell and spatial sequencing"
    ],
    "ethics": "animal ethics approval"
  },
  "provenance": {
    "proposedBy": {
      "type": "ai",
      "name": "Claude Code session e7dc5601 (Anthropic)",
      "model": "claude-opus-5",
      "session": "e7dc5601-1690-47c6-bf13-9ca150d31960"
    },
    "method": "manual reasoning from the cited sources' abstracts (PubMed) and Crossref metadata, checked 2026-09-11; no source opened at figure level",
    "date": "2026-09-11"
  },
  "review": {
    "state": "ai-proposed",
    "date": "2026-09-11"
  }
}
