{
  "type": "experiment",
  "id": "hrm:experiment/paired-biopsy-at-car-t-recurrence",
  "name": "Paired pre-treatment and recurrence biopsies in CAR T-treated glioblastoma",
  "tests": [
    "hrm:question/gbm-response-durability",
    "hrm:question/gbm-heterogeneity-defeats-single-target"
  ],
  "status": "proposed",
  "design": {
    "species": "human",
    "model": "patients treated with intraventricular or intrathecal CAR T in existing trials",
    "intervention": "none additional: tissue and CSF sampling at baseline and at progression",
    "comparator": "the patient's own baseline tumour",
    "readout": "antigen expression, single-cell state composition, CAR T persistence and phenotype in CSF over time",
    "duration": "2 years within existing trials",
    "n": "20-30 across centres"
  },
  "discriminates": "Antigen-negative recurrence points at multi-target therapy; antigen-positive recurrence with absent CAR T points at persistence and exhaustion; a recurrence in a state that was present and untargeted at baseline supports the plasticity hypothesis.",
  "feasibility": {
    "costClass": "low",
    "durationClass": "years",
    "requires": [
      "consent for repeat sampling in existing trials",
      "single-cell sequencing",
      "a shared protocol across the three active centres"
    ],
    "ethics": "amendment to existing trial approvals"
  },
  "provenance": {
    "proposedBy": {
      "type": "ai",
      "name": "Claude Code session b1762020 (Anthropic)",
      "model": "claude-opus-5",
      "session": "b1762020-2a53-4f0e-8cbd-18239bda19a3"
    },
    "method": "manual reasoning from the cited sources' abstracts (Crossref/Europe PMC), checked 2026-09-14; no source opened at figure level",
    "date": "2026-09-14"
  },
  "review": {
    "state": "ai-proposed",
    "date": "2026-09-14"
  }
}
