{
  "type": "experiment",
  "id": "hrm:experiment/wihn-human-xenograft-large-wound",
  "name": "Test wound-induced hair neogenesis in adult human skin xenografts after large excision",
  "tests": [
    "hrm:question/wound-induced-hair-neogenesis-in-human-skin"
  ],
  "status": "proposed",
  "design": {
    "species": "human skin on immunodeficient mouse",
    "model": "adult human skin xenografts with large full-thickness excisional wounds",
    "intervention": "wound size series with and without Wnt agonism",
    "comparator": "small wounds; untreated",
    "readout": "de novo follicles distinguished from surviving follicles by lineage and position",
    "duration": "6 months",
    "n": "skin from 5+ donors"
  },
  "discriminates": "Neogenesis in human skin with Wnt support shows competence is retained; none under any condition supports postnatal loss.",
  "feasibility": {
    "costClass": "medium",
    "durationClass": "months",
    "requires": [
      "human skin donors",
      "immunodeficient mice"
    ],
    "ethics": "human tissue and animal ethics"
  },
  "provenance": {
    "proposedBy": {
      "type": "ai",
      "name": "Claude Code session e7dc5601 (Anthropic)",
      "model": "claude-opus-5",
      "session": "e7dc5601-1690-47c6-bf13-9ca150d31960"
    },
    "method": "manual reasoning from the cited sources' abstracts (PubMed) and Crossref metadata, checked 2026-09-11; no source opened at figure level",
    "date": "2026-09-11"
  },
  "review": {
    "state": "ai-proposed",
    "date": "2026-09-11"
  }
}
