{
  "type": "experiment",
  "id": "hrm:experiment/silence-regrown-axons-large-animal",
  "name": "Regrow axons across a lesion, then silence them",
  "tests": [
    "hrm:question/regrown-axons-form-useful-circuits"
  ],
  "status": "proposed",
  "design": {
    "species": "rodent first, then non-human primate",
    "model": "complete transection with a combination regrowth protocol",
    "intervention": "chemogenetic or optogenetic silencing of the regrown population after functional recovery",
    "comparator": "sham silencing; non-regrown controls",
    "readout": "locomotor function with and without silencing; pain and spasticity measures",
    "duration": "12-18 months",
    "n": "10-12 per arm in rodent"
  },
  "discriminates": "If function collapses when the regrown axons are silenced, the new circuit is doing the work; if it does not, recovery came from spared fibres or plasticity and the regrowth literature is measuring the wrong thing.",
  "feasibility": {
    "costClass": "medium",
    "durationClass": "years",
    "requires": [
      "combination regrowth protocol",
      "chemogenetic tools",
      "primate facility for the second stage"
    ],
    "ethics": "animal ethics approval"
  },
  "provenance": {
    "proposedBy": {
      "type": "ai",
      "name": "Claude Code session b1762020 (Anthropic)",
      "model": "claude-opus-5",
      "session": "b1762020-2a53-4f0e-8cbd-18239bda19a3"
    },
    "method": "manual reasoning from the cited sources' abstracts (Crossref/Europe PMC), checked 2026-09-14; no source opened at figure level",
    "date": "2026-09-14"
  },
  "review": {
    "state": "ai-proposed",
    "date": "2026-09-14"
  }
}
