{
  "type": "experiment",
  "id": "hrm:experiment/verteporfin-porcine-full-thickness-wound",
  "name": "YAP inhibition (verteporfin) in a splinted porcine full-thickness wound model",
  "tests": [
    "hrm:question/en1-inhibition-translates-to-human-skin"
  ],
  "status": "proposed",
  "design": {
    "species": "pig (NCBITaxon:9823)",
    "model": "splinted full-thickness excisional dorsal wounds, paired within animal",
    "intervention": "local verteporfin at wounding and during proliferation, dose-ranging",
    "comparator": "vehicle, contralateral wound",
    "readout": "appendage count per area, collagen ultrastructure (SEM), tensile strength, closure time at 8 and 16 weeks",
    "duration": "4 months",
    "n": "8–12 animals, paired wounds"
  },
  "discriminates": "Appendages plus native ultrastructure in treated wounds favours conservation; closure without appendages favours the 'regeneration without neogenesis' hypothesis; no difference favours non-translation.",
  "feasibility": {
    "costClass": "medium",
    "durationClass": "months",
    "requires": [
      "large-animal surgical facility",
      "SEM histology",
      "the compound (approved for ophthalmic use)"
    ],
    "ethics": "animal ethics approval"
  },
  "provenance": {
    "proposedBy": {
      "type": "ai",
      "name": "Claude Code session e7dc5601 (Anthropic)",
      "model": "claude-opus-5",
      "session": "e7dc5601-1690-47c6-bf13-9ca150d31960"
    },
    "method": "manual reasoning from the cited sources' abstracts (PubMed) and Crossref metadata, checked 2026-09-11; no source opened at figure level",
    "date": "2026-09-11"
  },
  "review": {
    "state": "ai-proposed",
    "date": "2026-09-11"
  }
}
