{
  "type": "experiment",
  "id": "hrm:experiment/gene-corrected-epidermal-graft-long-term-registry",
  "name": "Long-term registry and integration-site surveillance of gene-corrected epidermal graft recipients",
  "tests": [
    "hrm:question/gene-corrected-epidermal-graft-long-term-safety"
  ],
  "status": "proposed",
  "design": {
    "species": "human",
    "model": "treated JEB patients and any future recipients",
    "intervention": "none (observational)",
    "comparator": "untreated skin of the same patients",
    "readout": "integration-site analysis, clonal dominance, malignancy, graft stability at 5, 10, 15 years",
    "duration": "10+ years",
    "n": "all recipients"
  },
  "discriminates": "Stable polyclonal maintenance without malignancy supports wider use; clonal dominance or transformation changes the risk calculus for every ex vivo integrating vector.",
  "feasibility": {
    "costClass": "low",
    "durationClass": "years",
    "requires": [
      "access to treated patients",
      "integration-site sequencing"
    ],
    "ethics": "consent for long-term follow-up"
  },
  "provenance": {
    "proposedBy": {
      "type": "ai",
      "name": "Claude Code session e7dc5601 (Anthropic)",
      "model": "claude-opus-5",
      "session": "e7dc5601-1690-47c6-bf13-9ca150d31960"
    },
    "method": "manual reasoning from the cited sources' abstracts (PubMed) and Crossref metadata, checked 2026-09-11; no source opened at figure level",
    "date": "2026-09-11"
  },
  "review": {
    "state": "ai-proposed",
    "date": "2026-09-11"
  }
}
