{
  "type": "experiment",
  "id": "hrm:experiment/transient-proliferation-pig-repeat",
  "name": "Repeat the pig cardiomyocyte-proliferation experiment with transient delivery and full cause-of-death reporting",
  "tests": [
    "hrm:question/controllable-cardiomyocyte-proliferation"
  ],
  "status": "proposed",
  "design": {
    "species": "pig",
    "model": "myocardial infarction",
    "intervention": "miR-199a or an equivalent proliferative signal delivered as mRNA or from a self-limiting vector",
    "comparator": "constitutive AAV delivery; vehicle",
    "readout": "cardiac MRI function, cardiomyocyte proliferation index, telemetry, survival with necropsy-confirmed cause of death for every animal",
    "duration": "18 months",
    "n": "10-12 per arm"
  },
  "discriminates": "Function recovered with survival under transient delivery would make controllable proliferation a live route; deaths under both delivery modes would indicate the proliferative state itself is the hazard.",
  "feasibility": {
    "costClass": "high",
    "durationClass": "years",
    "requires": [
      "large-animal cardiac facility",
      "mRNA or self-limiting vector manufacture",
      "telemetry and necropsy"
    ],
    "ethics": "animal ethics approval"
  },
  "provenance": {
    "proposedBy": {
      "type": "ai",
      "name": "Claude Code session b1762020 (Anthropic)",
      "model": "claude-opus-5",
      "session": "b1762020-2a53-4f0e-8cbd-18239bda19a3"
    },
    "method": "manual reasoning from the cited sources' abstracts (Crossref/Europe PMC), checked 2026-09-14; no source opened at figure level",
    "date": "2026-09-14"
  },
  "review": {
    "state": "ai-proposed",
    "date": "2026-09-14"
  }
}
